{
  "$schema": "https://json-schema.org/draft/2020-12/schema",
  "$id": "https://verifrax.github.io/tachyrium/schemas/cognition-output.schema.json",
  "title": "TACHYRIUM Cognition Output",
  "type": "object",
  "additionalProperties": false,
  "required": [
    "object_type",
    "schema_version",
    "output_id",
    "generated_at",
    "input_class",
    "output_class",
    "status",
    "summary",
    "payload",
    "boundary_assertions",
    "downstream_review_surface",
    "source_refs"
  ],
  "properties": {
    "object_type": {
      "const": "COGNITION_OUTPUT"
    },
    "schema_version": {
      "type": "string",
      "pattern": "^\\d+\\.\\d+\\.\\d+$"
    },
    "output_id": {
      "type": "string",
      "minLength": 1
    },
    "generated_at": {
      "type": "string",
      "format": "date-time"
    },
    "input_class": {
      "enum": [
        "constitutional-law-reference",
        "accepted-state-reference",
        "reconciliation-report",
        "repository-surface",
        "host-surface",
        "package-surface",
        "evidence-surface",
        "operator-request",
        "topology-request",
        "candidate-generation-request"
      ]
    },
    "output_class": {
      "enum": [
        "briefing",
        "candidate-object",
        "classification-summary",
        "contradiction-analysis",
        "topology-summary",
        "routing-candidate"
      ]
    },
    "status": {
      "enum": [
        "subordinate",
        "review-required",
        "bounded"
      ]
    },
    "summary": {
      "type": "string",
      "minLength": 1
    },
    "payload": {
      "type": "object"
    },
    "boundary_assertions": {
      "type": "object",
      "additionalProperties": false,
      "required": [
        "not-law",
        "not-state",
        "not-authority",
        "not-execution",
        "not-verification",
        "not-recognition",
        "not-recourse",
        "not-proof",
        "not-intake",
        "reviewable-subordinate-output"
      ],
      "properties": {
        "not-law": { "const": true },
        "not-state": { "const": true },
        "not-authority": { "const": true },
        "not-execution": { "const": true },
        "not-verification": { "const": true },
        "not-recognition": { "const": true },
        "not-recourse": { "const": true },
        "not-proof": { "const": true },
        "not-intake": { "const": true },
        "reviewable-subordinate-output": { "const": true }
      }
    },
    "downstream_review_surface": {
      "enum": [
        "human-review",
        "SYNTAGMARIUM",
        "ORBISTIUM",
        "CONSONORIUM",
        "AUCTORISEAL",
        "CORPIFORM",
        "VERIFRAX",
        "ANAGNORIUM",
        "REGRESSORIUM"
      ]
    },
    "source_refs": {
      "type": "array",
      "minItems": 1,
      "items": {
        "type": "string",
        "minLength": 1
      }
    }
  }
}
